### ISSUE TITLE
Xdebug on remote host

### ISSUE THREAD

**Issue by mpikosz00** [davidalger/warden#500]
I cannot configure xdebug on remote server using port forwarding. I manage to connect with bare apache2 so looks like it something with warden/docker. 
I create ssh tunnel using this command:
ssh user@ip -R 9000:localhost:9000 -o "ExitOnForwardFailure yes"

For the warden to run on a remote server i changed TRAEFIK_LISTEN:-127.0.0.1 to my server's ip in docker/docker-compose.yml. Im not sure if this is good move but it works :P 

Is it even possible?

**Comment by mpikosz00** [comment]
On remote machine when i run sudo tcpdump -vv -nn -i any dst port 9000 i can see messages but nothing is forwarded 

12:40:10.443013 IP (tos 0x0, ttl 64, id 15811, offset 0, flags [DF], proto TCP (6), length 60)
    172.20.0.8.41428 > 172.20.0.9.9000: Flags [S], cksum 0x5868 (incorrect -> 0x9c8a), seq 1978606001, win 64240, options [mss 1460,sackOK,TS val 826067569 ecr 0,nop,wscale 7], length 0
12:40:10.443030 IP (tos 0x0, ttl 64, id 15811, offset 0, flags [DF], proto TCP (6), length 60)
    172.20.0.8.41428 > 172.20.0.9.9000: Flags [S], cksum 0x5868 (incorrect -> 0x9c8a), seq 1978606001, win 64240, options [mss 1460,sackOK,TS val 826067569 ecr 0,nop,wscale 7], length 0
12:40:10.443070 IP (tos 0x0, ttl 64, id 15812, offset 0, flags [DF], proto TCP (6), length 52)
    172.20.0.8.41428 > 172.20.0.9.9000: Flags [.], cksum 0x5860 (incorrect -> 0x48c9), seq 1978606002, ack 1860089374, win 502, options [nop,nop,TS val 826067569 ecr 3626597969], length 0
12:40:10.443072 IP (tos 0x0, ttl 64, id 15812, offset 0, flags [DF], proto TCP (6), length 52)
    172.20.0.8.41428 > 172.20.0.9.9000: Flags [.], cksum 0x5860 (incorrect -> 0x48c9), seq 0, ack 1, win 502, options [nop,nop,TS val 826067569 ecr 3626597969], length 0

i also tried changing TRAEFIK_LISTEN back to 127.0.0.1 and using sshuttle to forward ports. Pages and services work but not xdebug :/
